{
  "$schema": "https://json-schema.org/draft/2020-12/schema",
  "$id": "https://schemas.metaframework.dev/acme/product/shop/datamodel/payment-method",
  "x-srn": "srn://acme/product/shop/datamodel/payment-method",
  "title": "Payment method",
  "description": "Tagged union of payment instruments. The tag property is \"method\".",
  "oneOf": [
    {
      "$ref": "https://schemas.metaframework.dev/acme/product/shop/datamodel/card-payment"
    },
    {
      "$ref": "https://schemas.metaframework.dev/acme/product/shop/datamodel/sepa-payment"
    }
  ]
}
